,body,class,date,id,score,subreddit
2652,"This series based on the life and diaries of Anne Lister, a 19th century West Yorkshire industrialist, landowner and *lesbian*, starts tonight - available through CraveTV (HBO) in Canada, HBO in US and BBCOne in UK, according to Wikipedia.

[https://en.wikipedia.org/wiki/Gentleman\_Jack\_(TV\_series)](https://en.wikipedia.org/wiki/Gentleman_Jack_(TV_series)) 

Happy to see that the series' Wikipedia page doesn't posthumously trans her - I recall there was a controversy over that due to the wording of a commemorative plaque recently dedicated to her. Neither does the series so far - she's a she. Plus, Suranne Jones plays her and she's always excellent. I'm just partway through watching the first episode - it's already shown her heartbreak when her girlfriend decides to accept a man's marriage proposal. There's some trailers out there on youtube too.",0,1555991645.0,bgbpxu,40,GenderCritical
2653,Korea's No.1 Spy-Cam Hunter On A Mission To Stop Illegal Porn,0,1555983971.0,bgafrt,57,GenderCritical
2654," Hi, this is the first time I post here I just wanted to share something that made me wonder if I am the awful one.   


I was talking to my BFF the other day, about a trans model who is very popular at the moment on my country, as we were talking, and I was giving my points on how he was popular just because being trans is a trend now,to which my friend constantly replied to me with things like *""stop being transphobic""* ?s*he is a woman just like us? ?she suffers as much as we do? ?you don't understand, she was born in the wrong body*? and such. To which I answered that he was not a woman, that he choose to endure transition, and he wasn't born in the wrong body. Then a moment of illumination came to me as she said ""*someday you will realize you are the one being wrong""* I realized that I truly could not care less for this people feelings, as long as they keep on destroying the few bits of liberty we have left, I am never going to be emphatic with their delusions. So then again, Am I the bad one?",0,1555980100.0,bg9s8l,63,GenderCritical
2655,"Looking for books on GC standpoint and/or transgender issues. I don't want webpages or online articles, I am specifically looking for books. If you think the book is too ""hateful"" to have in your post history, please DM me. Non-fiction, philosophy, arguments, and research are what I want. Something where if the topic of gender comes up, I am more than prepared to defend my position.",0,1555994405.0,bgc5ng,26,GenderCritical
2656,"Quote from a Facebook acquaintance:

>Basically, I am attracted to women, but only after an emotional connection is formed. I have to like who somebody is as a person to feel any physical attraction toward them.

>This has a bunch of implications that I had always thought were just me being weirdly prudish and morally uptight:

>-I have never had a celebrity crush

>-Hookup culture makes no sense to me

>-Flirting is not something I'm capable of doing on purpose, and being flirted with makes me uncomfortable

>-If a woman is not into sex, I cannot enjoy it, either; in fact, her pleasure is entirely what motivates me

>-If I try dating apps, I swipe left 99% of the time, can't flirt properly, and feel no motivation to respond to strangers' messages

>-Cheating on somebody is unfathomable to me because it would sacrifice an emotional connection for physical pleasure

>-If a supermodel approached me butt-naked I'd feel nothing, unless she started talking about sustainability and mindfulness, too

>-It's super rare for me to be attracted to anybody, so when I do have a crush it feels hugely important

He then goes on to explain how hard it has been for him in his life to be demisexual and thanks everyone for supporting him.

I'm going fucking insane. Since when was ""not a misogynist or a creep"" a queer sexuality? Why do we keep awarding straight as fuck men gay points?

Edit: I forgot to mention this man is 25 or about that age. Way too old for this shit.",0,1555953035.0,bg4lwf,204,GenderCritical
2657,"I've had a hard time during socratic sessions because every time its my turn and I deviate in any way towards trans-rationality I get dog-piled on. It always devolves into me being called a bigot, has anyone had any similar experiences in academia? Am really lost at the moment.",0,1555983040.0,bgaa3s,41,GenderCritical
2658,Educating girls is actually an effective way to combat climate change,0,1555970829.0,bg83vn,64,GenderCritical
2659,"Unpopular opinion. ""Men have it harder than women.""",0,1555981236.0,bg9z64,39,GenderCritical
2660,"Hi everyone,

I was wondering what you do to stay safe as a single young woman in a big city? I get harassed and sometimes followed on a regular basis. In my country I'm not allowed to carry a knife, a gun or peppers pray. The only thing you are allowed to carry with you is a type of paint that is kind of harmless, but penetrates the skin quite deeply and stays on your skin for 3 days (so if someone for example sexually assaults you, the perp will be identifiable for three days or so if you spray them with it). 

I'm thinking of taking self defense classes, but for things like home safety I'm kind of at a loss. 

Any ideas, tips, resources, books are helpful? Thank you in advance.",0,1555983540.0,bgad5s,30,GenderCritical
2661,"My parents have been telling me that my life's purpose is to have children ever since I was born (or so it feels like). A few years ago, I had been through absolute hell because my mom was desperate for grandchildren (she now has a grandson from one of my younger sisters). I grew up in a place in which most women become mothers at 20-22, and the general attitude is that you're not supposed to start having kids later because then you can't have as many kids. 

I'm now almost 24, and while I do not officially declare myself childfree (nor do I have any children), the expectation for women to have children has pretty much ruined my life. I don't want to go into too much detail, but I was harassed and emotionally abused and name called because I didn't want to have children at an early age. 

I was arguing with some anti-choice people a while back, and at one point one of them said: ""Women's mental health doesn't matter."" That really hurt because that's pretty much what my parents said to me (both if them are officially pro-choice but that didn't stop them) and what I have been taught growing up in my community. They told me that my current happiness doesn't matter because I'll be even more unhappy in the future if I don't have kids immediately. 

And I have an anti-choice coworker who frequently says ""those women can just give their kids up for adoption."" The fact that some women have zero sympathy when it comes to other women disturbs me. She's basically saying, ""She doesn't have to raise the child against her will, but she has to give birth against her will.""

I was also taught growing up that it's ""selfish"" to not want children. I'm sorry, but I think it's a lot more ""selfish"" to pressure other women into having children against their will. 

And what disturbs me so much is that a lot of people who say that they're ""pro-choice"" will defend surrogacy. Like is it suddenly okay to coerce a woman into giving birth as long as you pay for it? Do they not see how messed up that is? And they say ""it's a choice"" and ""they enjoy it,"" but money is coercion and pregnancy is an unhealthy ""hobby,"" unlike knitting or gardening. 

A while back, I made a post on here about men who claim that men are ""attracted to signs of fertility"" and how that's bullshit since hairlessness and smooth skin aren't signs of fertility. What disturbs me is that men would start telling me these things after I would go on a body positive monologue or something. They would say ""body positivity is bullshit since men are attracted to signs of fertility."" If not meeting current beauty standards were actually a sign of infertility, wouldn't that be even more of a reason to be body positive? What these men are basically saying is: ""Your self worth is determined by your fertility and so you can't enjoy anything if it means that you're infertile."" 

I was actually crying yesterday about how women aren't allowed  to have autonomy over our reproductive systems. Even some of the most ""leftist"" (and I put ""leftist"" in quotes because they aren't real leftists) people I know will defend surrogacy. Like there's no escape from any of this. And I only covered a small fraction of the ways in which women are exploited for their reproductive systems. 

And this is part of the reason why I'm angry every single time I see TiMs with a pregnancy fetish. They will never go through what women go through because of our reproductive systems. And they declare themselves ""infertile women,"" which is super offensive because they weren't told growing up that their life's purpose is to have children.",0,1555953854.0,bg4rtm,143,GenderCritical
2662,"In this speech class I am taking we have this thing called question of the day, where the teacher asks a question and everyone has to answer to have  a discussion. Well, today's Q was hoe many kids do you want and how many is too many.  What was sad was pretty much all the guys in the class said they didn't care if they had a boy or girl...but all the girls wanted boys because they were tomboys and this one girl said I would be devastated if I had a girl and lauhged really loud.  I jumped in and said you ARE a girl, and no they are not that bad.  She just stammered and said ""Well, I don't want someone to be like me"" The teacher just said you are right, girls are hard to raise :>(.  I was just glad I actually said something instead of doing what I usually do and keeping quite. 
It is gross how people act like boys are just so amazing and girls are just horrible.  I have a daughter who is very sensitive too people making fun of her for being girly and it sucks...She shouldn't have to put up with that.  Boys have their issues too and are not these wonderful, fun beings that bring people joy; while girls are the opposite.  In fact,  I will even go so far as to say this is really unfair to boys too.  Not all boys love sports,  boys absolutly CAN  be overly emotional ans acting like boys are either monsters or little angels is just horrible parenting.",0,1555950455.0,bg43mz,131,GenderCritical
2663," [http://www.bbc.com/capital/story/20190419-should-prostitution-be-a-normal-profession](http://www.bbc.com/capital/story/20190419-should-prostitution-be-a-normal-profession) 

&#x200B;

And of course they quote the academic who is an occasional prostitute when she feels like it. Because all prostitutes are just doing it for a giggle once in a while to make some extra cash. 

&#x200B;

Talk about privilege...",0,1555962313.0,bg6g3a,62,GenderCritical
2664,So fucking tired of being told I'm 'acting like a man' when it's just me and my personality. I've even gotten this shit from certain feminists who think i'm practicing 'toxic masculinity' even as a woman.,0,1555932206.0,bg0xa7,223,GenderCritical
2665,Life after death: Sherpa widows eye Everest to fight taboo.,0,1555965105.0,bg6zqe,38,GenderCritical
2666,"Hi there: New here, and new to Reddit, at least as an actual registerer user (as opposed to a casual occasional browser). Really appreciating all the resources here, as well as the organization of them. Thank you!

I thought other left, gender-critical feminists might find it buoying to see this fundamental but constantly ignored point being made about how adopting gender identity ideology undermines the validity of class analysis. The *Weekly Worker,* which is the newspaper of the Community Party of Great Britain, is certainly not a publication I read regularly, but I find it rare and so refreshing to have *any* kind of leftist publication make sense on this topic. I never thought that I'd have to argue for the relevance of material reality to other leftists, but sadly, that's what it's come to. Glad to see that this author gets it.

*The fact that much of the left unquestioningly accepts and regurgitates an ideology in which the subjective feelings of the individual trump objectively observable conditions is a sign that we have abandoned the physical, material reality on which our politics is based, and replaced it with a subjective individualism that is alien to any class-based analysis.*

[https://weeklyworker.co.uk/worker/1247/decoupled-from-reality/](https://weeklyworker.co.uk/worker/1247/decoupled-from-reality/)",0,1555953495.0,bg4p9i,66,GenderCritical
2667,https://youtu.be/6YtOOrWYMfA,0,1555952249.0,bg4g7b,63,GenderCritical
2668,How Body-Positivity Promotes Beauty Bias,0,1555960812.0,bg65eq,41,GenderCritical
2669,[https://www.youtube.com/watch?v=GZc0cRLzp1w](https://www.youtube.com/watch?v=GZc0cRLzp1w),0,1555943943.0,bg2ur4,86,GenderCritical
2670,Supreme Court to Decide Whether Civil Rights Law Applies to Gay and Transgender Workers,0,1555983105.0,bgaaid,9,GenderCritical
2671,"I know that this isn't something new to anyone, but it's just so depressing seeing how women are so pushed to hate their age (and well, everything about themselves, but that's a longer conversation).

Just saw it in some hobby group on Facebook, where 90+% of the members were female 

Someone asked other's ages because of too many little kids getting in the group despite the rules forbidding it (nothing deviant was going on, it's just that lots of the posts in the groups are sales), and only very few women could JUST post their age, most would have to add some variation of ""but I look younger"" (as if expecting praise) or apologies for being ""old"" (the ones 30 and older, who are the majority of people into the hobby anyway).

As in, your age can't be just right, if you're self confident you have to say you look/feel younger, and if you're insecure you have to low-key insult yourself for your age.

Even 20yo women call themselves old all the time while 50yo men pretend they're the hot shit and 17yo girls would be lucky to get them",0,1555933914.0,bg16cp,126,GenderCritical
2672,"I just read a post where a woman was called a bridezilla for not wanting to invite someone. And it got me thinking. Why did that word even start? Why are women bridezillas for not rolling over and letting people walk all over them? Why are women expected to be ?chill? about their wedding?

We?re told from an early age that your wedding is the most important day of your life but you?re not allowed to care about it. If you do, you?re a bridezilla and the marriage is the most important part. Um what? How is this big party supposed to be planned if Bridechilla doesn?t do anything.

Don?t forget that the men aren?t usually involved. Women just have an eye for this remember????? /s. 

Ugh anyway, sorry just had to get that off my chest.",0,1555938791.0,bg1ylb,96,GenderCritical
2673,"I have been mulling this a lot through a gender critical lens recently, and I wanted to get other women's thoughts on the subject :


A few weeks ago I woke up to my husband sat next to me, on my side of the bed, fully dressed, shoes on, hat on, coat on, backpack on. I went straight into a mild worry, because this was entirely out of the ordinary, and hey, I'd just woken up, and asked him what the matter was. He explained his work related stress to me, and seemed to want some advice.

The only advice I could give, unmedicated and uncaffeinated as I was, was for him to not go into the office and talk to his bosses with an ultimatum and pure anger as he was letting out with me, but rather to introduce the concerns he has as problems he needs assistance with.

 I told him to use the words 'think' and 'feel' more, to not go into the meeting spouting his anger as fact, but rather go through his thought process step by step.

There was some more conversation, but once he seemed calmer and more settled in himself he headed out, and as I had a few minutes to process the conversation I'd just had, the weirdest worry hit me: was that advice appropriate for a man? And then I got angry at myself for even asking that question and worrying about it. I wish more of my male colleagues didn't present every single opinion they hold as fact, so why not give the advice when it is asked for?


And, on the other hand, is it wrong advice? Advice based on having been born and raised a girl? Softening my language so as to not offend, not to ruffle any feathers?


I suppose what I'm asking is what do you think? Is it a skill? A hindrance? A bit of both? Do you find the advice you give changes depending on the sex of the person you're talking to? Do you even find yourself giving men advice?",0,1555972415.0,bg8elk,15,GenderCritical
2674,This Korean Actress Is Risking Her Life To Expose The Truth About Jang Ja Yeon,0,1555949265.0,bg3ve2,53,GenderCritical
2675,"After having had her amazing animated film (which I?ve posted about here before), [Seder Masochism](http://sedermasochism.com/), de-platformed multiple times by trans activists, it will finally be screened in Urbana, Illinois at the ~~Virginia~~  Victoria theater on Wednesday, May 8th at 7pm. The screening is FREE. A panel discussion with Nina and others will follow.

Read more about the screening here: [https://blog.ninapaley.com/2019/04/19/seder-masochism-a-free-public-screening-featuring-a-panel-discussion-with-filmmaker-nina-paley-immediately-following-the-movie/](https://blog.ninapaley.com/2019/04/19/seder-masochism-a-free-public-screening-featuring-a-panel-discussion-with-filmmaker-nina-paley-immediately-following-the-movie/)

Seder Masochism is a witty and subversive re-telling of the Exodus story ? this time including the suppression of the goddess religion that preceded the emergence of Judaism.

Because Nina had the temerity to assert, ?If a person has a penis, he?s a man? her film has been targeted for de-platforming by trans activists even though the film has nothing whatever to do with transgenderism. (Read more about blacklisting on her blog here: [https://blog.ninapaley.com/2019/04/06/blacklisted-bullied-threatened-and-libeled/](https://blog.ninapaley.com/2019/04/06/blacklisted-bullied-threatened-and-libeled/)

You can support Nina and her incredible film by:

 Attending

 Donating to her GoFundMe: [https://www.gofundme.com/lets-save-lives-by-investigating-Passover](https://www.gofundme.com/lets-save-lives-by-investigating-Passover)

Why a gofundme? Because it?s expensive to host a screening at the Victoria ? a site chosen because it is publicly owned and therefore (presumably) cannot exclude anyone because some group doesn?t approve of their political views.

Please support yet another woman whose livelihood and character has been attacked by transactivists. Thank-you!",0,1555939838.0,bg24oe,81,GenderCritical
2676,"Female Teachers Need Protection from Sexual Harassment, says Union",0,1555945692.0,bg36il,60,GenderCritical
2677,"On the front page now with over 20,000 up votes: ?How is a trans four-year-old like a vegan cat?? One of our most top rated posts of all time here.",0,1555931588.0,bg0u2k,107,GenderCritical
2678,"Kickstarter for a CG Game trying to categorize as ""a tactical RPG/SHMUP hybrid"" is actually a disguise for Typical Waifu Porn",0,1555978589.0,bg9j4h,10,GenderCritical
2679,"?I Want What My Male Colleague Has, and That Will Cost a Few Million Dollars?: Women at the Salk Institute say they faced a culture of marginalization and hostility.",0,1555934258.0,bg188v,82,GenderCritical
2680,Trailer for TRA Sports Documentary ?Changing the Game?,0,1555947508.0,bg3ito,37,GenderCritical
2681,Are there any parts of femininity you consciously decided to unlearn? How did you do it?,0,1555945660.0,bg36ba,42,GenderCritical
2682,The Digital World Is Not Designed To Keep Women Safe. New Regulations Should Be.,0,1555955995.0,bg574m,24,GenderCritical
2683,"Hello GC,

Been lurking for a while and created a new account to post here since GC discourse is wrongthink in some of my hobby related groups and I don't want to get chucked out. I have been becoming increasingly GC over the last 6 months or so but there is one thing I am struggling to get my head around. If we accept that there is no such thing as a male or female brain, how can we justify male violence? Hormones and social conditioning etc are not independent of neurodevelopment and neural plasticity might mean that any differences are linked to that those factors rather than just XX or XY but that would still result in sex differences in adult brains right? I work in mental health with a particular interest in neurodevelopmental disorders such as autism and how these affect girls. When we know that there are sex differences in mental health outcomes and prevalence, in behaviors like aggression and in the behavioral expression of the same genotypes I struggle to see how there can be 0 differences across sexes.",0,1555945340.0,bg344q,34,GenderCritical
2684,"I'm looking for some direction on female sexuality? I'm newer to reading feminist works, but female sexuality keeps coming up (peripherally in books focused on other topics) as something distinct from the dominant/submissive male sexuality we're raised to conform to as default. I'm looking to undo some of the damage from forcing myself to conform to male ideas of sexuality/submission while also growing and learning about collaborative sexuality. Any recommendations would be greatly appreciated. Thanks!",0,1555940669.0,bg29p7,29,GenderCritical
2685,"Time to take up this week's open thread with topics chosen by you, our subscribers, 30,000 strong and growing. Post and discuss any topic!

Open thread starts every Monday morning!

**Bulletin Board:**

* [Vancouver Rape Relief](https://redd.it/b1j95d) is our cause this month. VRR is a great shelter that helps a lot of women, and has been under seige by trans activists for over a decade because they refuse to give men access to vulnerable women. Trans activists recently got the city to stop giving them funding.

* r/ActualWomen is our sister subreddit of the month. This subreddit is for women to discuss whatever they want with other women and only other women. Men are always banned on sight. 

* Our community sprawls across Reddit, check out our list of [sister subreddits](https://www.reddit.com/r/GenderCritical/wiki/sistersubreddits). 

* We have a GC Women Discord server. Check out r/GCChat to apply.

* If you live in Seattle, Portland, Boston, Chicago, Indianapolis, Champagne-Urbana, Madison WI, Toronto, or Victoria BC, [there are radical feminist groups in your area](https://www.reddit.com/r/Radical_Feminists/comments/amwnxs/radical_feminists_in_seattle_portland_boston/?st=jrpockzh&sh=708b3546).",0,1555929502.0,bg0kbb,28,GenderCritical
2686,"A few members in a previous post were discussing the unlikelihood of women to change ideologies from gender critical to trans positive. However, sometimes I do doubt myself.

It is generally in the face of friends, colleagues, and people I respect who consider themselves to be ""nonbinary"" to some degree. I am in a field where this is perhaps more common to encounter. But the thing is, I love these people and I want to support them. They are good people, smart people, not anyone that I would want to come into conflict with or emotionally hurt. I want these people to succeed and be happy with themselves and present as ""masculine"" or ""feminine"" as they want. And I don't think that this desire is diametrical to GCF.

But I know that if my colleagues *knew* that am GC that it would hurt them. And I wonder if it is more important to be kind and supportive or to stick to my commitment to women's liberation. I don't want it to be this clash where it must be women's rights or trans rights, I really am bothered that they collide (although, that's why we are labelled TERFs, I know). But what I come back to is the old homophobic, Christian adage of ""love the sinner, hate the sin."" This is what I feel I am doing when I am kind and affirming to transgender people in my life, but support GC causes in my private life. It makes me feel like a hypocrite and a jerk.

TL;DR - have you ever come into a situation where you thought that being GC was actually harmful and how did you negotiate these feelings?",0,1555911177.0,bfyfb0,64,GenderCritical
