,body,class,date,id,score,subreddit
1000,"Lauterbrunnen, Swiss Alps.",0,1556299849.0,bhp18v,356,MGTOW
1001,This domestic abuse billboard acknowledges that female abusers exist,0,1556334540.0,bhuwn3,1553,MGTOW
1002,Hypergamist thot's confession.,0,1556323507.0,bht9sd,1002,MGTOW
1003,Before MGTOW (2018) | After MGTOW (2019),0,1556333917.0,bhutic,436,MGTOW
1004,About what we expected,0,1556359927.0,bhxotx,114,MGTOW
1005,Reality Check,0,1556322688.0,bht4zy,512,MGTOW
1006,Another reason to go MGTOW! (some religious chick posted this to feel righteous),0,1556365957.0,bhyc2s,62,MGTOW
1007,You are ??? catching that bouquet... ??,0,1556314970.0,bhruhe,597,MGTOW
1008,The growth acceleration of the MGTOW subreddit.,0,1556316431.0,bhs3os,516,MGTOW
1009,The fucking equality... can you feel it? This is what women meant by gender equality,0,1556365515.0,bhya7i,44,MGTOW
1010,"Just skip the drama, and GYOW",0,1556330823.0,bhudvy,223,MGTOW
1011,Break free from the matrix.,0,1556344786.0,bhw5uh,108,MGTOW
1012,Single moms suck,0,1556288751.0,bhmvph,1786,MGTOW
1013,Thot Rekt,0,1556348618.0,bhwktu,74,MGTOW
1014,How long you going to be?,0,1556317428.0,bhs9uq,376,MGTOW
1015," Toronto woman sues Rogers after her affair is exposed

"" 

A Toronto woman says the billing practices of Rogers Wireless Inc. led to her husband discovering her extramarital affair.

Now the woman, whose husband walked out, is suing the communications giant for $600,000 for alleged invasion of privacy and breach of contract, the results of which she says have ruined her life.

In 2007, Gabriella Nagy had a cellphone account with Rogers which sent the monthly bill to her home address in her maiden name. Her husband was the account holder for the family's cable TV service at the same address. Around June 4, 2007, he called Rogers to add internet and home phone.

The following month, Rogers mailed a ?global? invoice for all of its services to the matrimonial home that included an itemized bill for Nagy's cellular service, according to the statement of claim filed in Ontario Superior Court of Justice.

When Nagy?s husband opened the Rogers invoice, he saw several hour-long phone calls to a single phone number.

?Nobody does business this way and he's not stupid,? says Nagy, who is in her 30s. He called the number, spoke to the ?third party? who confirmed the affair, which had lasted only a few weeks, Nagy told the *Star*.

?My husband didn't tell me that's how he found out, he just left.?

&#x200B;

"" 

Nagy is deeply embarrassed and ashamed about what happened. ?It was a mistake,? she said of the affair. ?But I didn?t deserve to lose my life over it.?

After her husband left her and their two children, ages 6 and 7, she was so distraught her work performance suffered and she lost her job as an apartment rental agent that had paid her almost $100,000 until she was let go in Oct. 10, 2007. ?The plaintiff wept uncontrollably at her workplace . . . and became incapable of performing her employment duties,? reads the statement of claim. Nagy says the employer was aware of the situation and that she was receiving medical attention.

Nagy?s lawyer, Edward Tonello, says this case is unprecedented in Canada.""

[https://www.thestar.com/news/gta/2010/05/17/toronto\_woman\_sues\_rogers\_after\_her\_affair\_is\_exposed.html](https://www.thestar.com/news/gta/2010/05/17/toronto_woman_sues_rogers_after_her_affair_is_exposed.html)

&#x200B;

A women, get caught cheating, fuck up your$100,000  job renting apartments which requires almost zero skill in a place like Toronto where 10,000 immigrants jump off the plane everyday looking for rentals, blame the phone company, its not MY FAULT I Cheated, it is the phone company for making me get caught!",0,1556328823.0,bhu3gd,204,MGTOW
1016,Daily Recommended Dose of MGTOW,0,1556324060.0,bhtd9w,268,MGTOW
1017,This belongs here,0,1556328004.0,bhtz18,205,MGTOW
1018,Don't be that girl,0,1556333315.0,bhuql6,143,MGTOW
1019,"The guy has been a part of my life since my early teens, for 20 years. I love him like a brother.

He has a very attractive face and is slim and tall. He was always popular with women and I think he never saw their negative side.

Unfortunately, he has a very weak personality. He always conforms to his current girlfriend. When he was dating a Christian girl, he was also a devout believer. His fiancee is now a radical feminist - so he's an atheist and also a radical feminist.

The woman is openly man-hating. She is spouting all the stereotypical crap about the wage gap, female oppression, welcoming of immigrants and so on. She literally told me to stop working out because I'm muscular enough already, even though I'm nothing special (no humblebrag intended). Guess I was a bad influence on her victim... She takes issue when we discuss female beauty but she was openly ogling a ripped black dude when we were in the baths a while ago (in the very presence of her fiancee). She is the embodiment of the cancerous 3rd wave feminist.

And now my best friend is going to swear before the law that they'll be together forever and link assets.

There's nothing to be done. I've been trying to redpill the guy for years but he just doesn't have the intestinal fortitude. I guess all there's left now is saving space on the couch for him to sleep on after his divorce-rape.

All this just sucks.",0,1556352377.0,bhwy3k,56,MGTOW
1020,Statistical growth of MGTOW: One month after 100k subscribers we now have 105k. This is what it will look like in 1 year.,0,1556353461.0,bhx1uh,52,MGTOW
1021,Well...,0,1556359640.0,bhxns3,42,MGTOW
1022,"I live in a dormitory while I study a trade. I recently put up a notice offering standard repair services, such as assembling furniture, putting up lamps and whatnot.

My only customers so far have been women with hopelessly easy jobs. This morning I charged $10 to put a chain on a bike for a girl, took me literally 5 minutes. In the meantime, she was observing me with a sly smile.

It's good spare cash, and it helps me practice general skills, but the sheer satisfaction of proving to myself how invaluable men really are to women, and how much we can capitalize on it, is the true reward.",0,1556366822.0,bhyfx7,23,MGTOW
1023,Just LOL stuff.,0,1556344703.0,bhw5ja,76,MGTOW
1024,Belongs here....,0,1556315983.0,bhs0ns,300,MGTOW
1025,"Nicolas Cage got married to a lady she dated for a year. 4 days later, he wanted a divorce. The ex wants alimony after 4 days marriage.

And they call us losers for not wanting to get married? Bill pillers are useless.

https://www.msn.com/en-za/entertainment/celebrity/nicolas-cages-estranged-wife-asking-for-spousal-support/ar-BBWbAKd?li=BBqfP3n",0,1556367260.0,bhyhwg,17,MGTOW
1026,So another one. Just for Laughs.,0,1556343686.0,bhw1i6,57,MGTOW
1027,Kamala Harris wants to classify all female sex workers as victims so as to avoid arresting them. But of course imprison their customers.,0,1556330503.0,bhuc6o,114,MGTOW
1028,"I wonder if she actually thinks being ""tall"" is why no one matches her",0,1556312494.0,bhrek3,272,MGTOW
1029,Hitting the wall at terminal velocity.,0,1556347245.0,bhwfn7,46,MGTOW
1030,I?m just gonna leave this here..,0,1556369364.0,bhyr2q,15,MGTOW
1031,"Older woman giving advice, accidentally redpilled a future simp",0,1556347403.0,bhwg7o,43,MGTOW
1032,omg like who goes to the gym to work out?,0,1556276256.0,bhkzl7,1526,MGTOW
1033,"Apparently, its ok to get someone fired if they're a MGTOW",0,1556296034.0,bhoa30,515,MGTOW
1034,"Ever since I've taken the ""red pill"" by reading a few of the books that were recommended in the side bar I just can't get excited about movies anymore. Like, everyone is making a big deal out of marvel these days and I think it's ... meh? I still like the comics though. I feel like all movies are the same these days, every movie is a love story blah blah",0,1556367041.0,bhygxf,14,MGTOW
1035,I wonder if Melbourne is the most feminist city ? ( which makes it most liveable ?),0,1556364825.0,bhy7cr,17,MGTOW
1036,"Went out with a women a few times earlier in the year.

We seemed to connect. Had things in common in our background. Had fun together.

Not looking for anything more. We're both older, late 50's, so not naive about things at all.

So it's looking good. Someone to do things with.

&#x200B;

Ha. So after a couple of months she tells me she's still in touch with a guy she'd been dating the year previous. He wants to keep in touch and see her.

Suddenly she's not sure about anything. Want's some time.

*What the fuck? Are you kidding me? How fucking old are you?*

&#x200B;

Then the last few weeks she emails a couple of times. Trying to set up an outing together like we were doing before.

I just push it off. I actually have things to do right now. No big deal.

&#x200B;

So I get an email tonight basically with her hurt feelings, yadda yadda blah blah.

&#x200B;

Good God. Late 50's and ***She's Just Like That.***

The never change. It's never different. LOL.",0,1556333761.0,bhustm,73,MGTOW
1037,This is why David's Bridal filed for bankruptcy ????,0,1556344484.0,bhw4pa,43,MGTOW
1038,Who needs a clown for their birthday party?,0,1556331793.0,bhuiy6,76,MGTOW
1039,"Amazon Used An AI to Automatically Fire Low-Productivity Workers

https://futurism.com/amazon-ai-fire-workers/?utm_source=Digest&utm_campaign=e1f544f463-EMAIL_CAMPAIGN_2019_04_26_06_36&utm_medium=email&utm_term=0_03cd0a26cd-e1f544f463-250206509&mc_cid=e1f544f463&mc_eid=6a0d241a02

well gentlemen, could women survive out there without the affirmative action?",0,1556357902.0,bhxheg,20,MGTOW
1040,Mgtow in a nutshell.,0,1556300432.0,bhp5eq,366,MGTOW
1041,She thought I would say: I GoT YoU GiRL lol think again.,0,1556337238.0,bhv9gk,53,MGTOW
1042,My favorite quote.,0,1556305488.0,bhq4em,232,MGTOW
1043,Based villain in Justice League,0,1556373621.0,bhzby9,7,MGTOW
1044,Calvin and Hobbes,0,1556336056.0,bhv3y8,50,MGTOW
1045,Uh oh.,0,1556346087.0,bhwb4p,33,MGTOW
1046,Someone needs to take MGTOW lessons.,0,1556373060.0,bhz94d,7,MGTOW
1047,Wife confessed that she was cheating on husband for 8 years and only married him for financial support.,0,1556329448.0,bhu6p3,67,MGTOW
1048,MGTOW SATURDAY all the way folks. Just chilling with fruit juice and some good indian food. Let us celebrate our lives.,0,1556344926.0,bhw6g7,29,MGTOW
1049,"this post is old, 3 years ago: 

https://amp.reddit.com/r/france/comments/2sqv2i/why_is_paternity_testing_illegal_in_france/

but just look at the responses!!! 
Jesus Christ, are these people out of their minds? they're all (without even one exception) trying to justify the BAN ON PATERNITY TEST in France. 
what's wrong with these people? 
they turn evey shit into ""philosophical"" argument, shits like: ""family is not parallel to genetics"" and bullshits like ""you don't necessarily have to give your sperms to become a father"" and shits like that. 
I'm going outrageous now but can't even begin to comprehend the level of cuckoldery over there. 

this literally has one simple message for French women: ""as long as you're not banging that arab immigrant from Syria and are only fooling around with white dudes, you're good to go since your hubby can't determine whether it's his child or the chad next door.""

even if you take a test OUTSIDE France, you're still going to be put in jail for 1 YEAR and 15,000 ? fined just because you doubted your wife's infidelity.

it's like they pass a law in USA that will send you to jail if ever hired a prostitute in Thailand, seems ridiculous, but since prostitution is illegal in USA, you must go to jail anyway. thank God they haven't passed it yet.

apparently the mental health of the CHAD'S child is more important than the MAN'S.

now gentlemen, take a look at primates' family cores, we're going backward the million years of evolution in just a few decades. this is what happens when you fight with nature, nature never wanted powerful women, nature never wanted feminist women, nature always wanted strong men, nature wanted virgin women, think about it gentlemen, why did women evolve in this way? why did women evolve to have virginity? but when you go against the nature, you will go backward in evolution, as simple as that.",0,1556353499.0,bhx1zc,23,MGTOW
1050,Wife tells husband she only married him for money but now loves him. He makes the right choice but I?m sure he?ll be divorce raped,0,1556363784.0,bhy36a,12,MGTOW
1051,Poor dad,0,1556297588.0,bhokxn,300,MGTOW
1052,I?m a MGTOW trucker since 03 and this is what I get paid every week. This is perfect career for a man looking for adventure and make major bank?,0,1556287503.0,bhmnkb,483,MGTOW
1053,Be careful guys,0,1556295313.0,bho53t,322,MGTOW
1054,All THOTs and wahmen should pay attention to this,0,1556358946.0,bhxl8j,12,MGTOW
1055,It?s almost like they go to the gym to work out not talk to thots,0,1556315833.0,bhrzr9,111,MGTOW
1056,Go you own way,0,1556305993.0,bhq7op,185,MGTOW
1057,The number for men just jumped to 71% in my city just saw the news like few minutes ago... Tbh men don?t have many resources or platforms like women do and it?s sad. As a man hustle is the only way to go.,0,1556335008.0,bhuywu,42,MGTOW
1058,"Right, ""men"".",0,1556361477.0,bhxudj,11,MGTOW
1059,Found something funny watching re runs,0,1556322795.0,bht5n2,80,MGTOW
1060,He's on the verge of a red pill...,0,1556336173.0,bhv4gy,37,MGTOW
1061,"But but men are stronger, women can't abuse them...",0,1556367134.0,bhyhcz,8,MGTOW
1062,Coachella music festival is a great place to meet women (riddled with STDs),0,1556369986.0,bhytxa,7,MGTOW
1063,"I've had this new job for a year now. It's a great company, but my department is definitely on the smaller side. I've worked closely with this chick for the last few months, and we have even had lunch together a few times at work. She's very intelligent and pretty hard working, and overall she's pretty cool.

Today, I got a text from her asking if I wanted to hang out with her and her boyfriend tomorrow. What kind of guy would ever sign up for that?

Edit: We have hung out outside of work before. We occasionally have team activities where our managers will take our whole group out somewhere, and we kind of separate into smaller groups and do our own thing. Each of those times that girl and I have hung out with 1-2 other people. So it's not like we've never hung out outside of work. Still though, this doesn't feel right. I think I'm just going to say ""I'm going to pass on that. Thanks for the invite though""",0,1556372983.0,bhz8rb,7,MGTOW
1064,"I have decided to stop straddling the fence, to fully embrace my MGTOW nature and to go full on monk mode. It's something I've been thinking of doing for years now. But I didn't have the courage to make that final permanent step. I still believed that women were ""redeemable"". That's it was still possible to build a family with a so-called ""good woman"". But as time has gone on, I've realised that all women are the same, and all women are abominable and irredeemable. 

I knew all of this subconsciously, but I still fought against it, because I was still under the blue pill romanticized mindset of love and commitment. But now my patience and tolerance for women has completely run out. My whole life, women have done nothing but make my life miserable. My mum was abusive, the girls at my school used to bully me, and I have never had a long term relationship with a female. And to be totally honest, I don't want to anymore. I just don't care anymore. I have no love for women whatsoever. I have decided to go full MGTOW monk for the rest of my life. 

I am only 20 years old, and I still have my whole life ahead of me. And that is why I truly believe that MGTOW is the future for young men. Because there is so much MGTOW content out there. Men of all ages, young and old are waking up and saying no to relationships, women and marriage. The great awakening is happening as we speak, and I believe that young men are the future pioneers of the MGTOW philosophy. 

TL;DR: I've fully given up on women, I've become a MGTOW monk for life, MGTOW is the future for young men.",0,1556321698.0,bhszei,66,MGTOW
1065,Delusion 100,0,1556375299.0,bhzl12,4,MGTOW
1066,True story,0,1556346621.0,bhwd8p,16,MGTOW
1067,What could this possibly mean?,0,1556346225.0,bhwbo9,18,MGTOW
1068,Realistic dating options,0,1556290089.0,bhn4so,302,MGTOW
1069,"not really looking to type the whole story, but I really need some supportive words right now.  I haven't felt like this in a long time.  I can't even look at myself in the mirror and there aren't enough drugs on me to escape from this sensation.  Fuck.  I'm hoping i'll wake up tomorrow and it'll all pass and  continue on my path.  Nothing gained, nothing lost except another illusion.  Just typing that makes me feel better because shedding off these women who don't contribute anything to your well-being is extremely beneficial.  I really just fooled myself into thinking I wasn't as invested emotionally as I actually was.  We all fuck up, but I really feel like such a FUCK.   Hopefully I can always use this example as a future reminder: AWALT.",0,1556341325.0,bhvrs1,24,MGTOW
1070,Poor guy.. Hope he'll GHOW soon. What a cunt.,0,1556373658.0,bhzc5o,4,MGTOW
1071,"Hello gents! 

Although unicorns and NAWALTS will never exist in reality.... a man can indulge in idle daydreaming as to what a Waifu might be like.... and the moments shared with her.

&#x200B;

To that end, I sometimes fund personal projects in addition to the stories I write and hire others to give voice to.

But more than that, sometimes I just wanna *see* those moments that my stories articulate.

&#x200B;

Allow me to share a creation that I commissioned from a freelancer artist. I hope you like it. 

Yes, it does depict a bit of a sappy ""blue-pill"" moment. But in my defense, as the author... I hold absolute power over this particular Waifu, and 2D>3D every time.

&#x200B;

&#x200B;

[2D \> 3D Forever](https://i.redd.it/2wxmkrhcaru21.jpg)",0,1556348812.0,bhwlkn,16,MGTOW
1072,Indoor legal grow with a special lady (Super Skunk fem) from the garden getting nice and fat under a 600HPS. Five more ladies behind me and they smell amazing. Only females I will spend $ on.,0,1556307074.0,bhqf0z,117,MGTOW
1073,Not today satan,0,1556341975.0,bhvuk5,19,MGTOW
1074,Dead bedroom > Porn > Murdered - Just GYOW,0,1556376489.0,bhzruc,3,MGTOW
1075,"I'll make this as short as possible.  


\- Father got cancer.

\-  The 2 years he had it, she did nothing but talk about money. She'd only dated him a few months prior to when He was diagnosed.

\- Made everything about her. Attacked me a few days after he died because the obituary and Eulogy didn't mention her as much as she would have liked.

\- She was out partying thinking he was leaving her with everything. Celebrating for his death. We left her with nothing. She wouldn't sit with him in Chemo nor drive her car to take him, all in fear of ""Driving up the miles"". Even when he was terminal.  
\- Father was incredibly well respected doctor. She is on our phone plan still, I check her numbers. She is still trying to call his doctor friends and essentially circles from person to person. She is a narcissist and needs attention.   


How do I get this woman out of my fathers legacy and life? To say I am repulsed is an understatement. It's like a child pissing on a work of art. He had so much respect from his colleagues. Everyone loved him, NO ONE likes her.  


It is so unbelievably intrusive that she will not get out of our lives.",0,1556376423.0,bhzrg9,3,MGTOW
1076,"The modern western pig/""woman"".",0,1556298023.0,bhoo0x,170,MGTOW
1077,"What makes a ?spouse?? In family court, the details can make all the difference",0,1556349948.0,bhwpri,10,MGTOW
1078,"Well, the top comment is amazingly bad advice, bu...

https://www.reddit.com/r/relationship_advice/comments/bhnkjs/my37m_wife39f_just_told_me_that_she_initially/eluz1li?utm_medium=android_app&utm_source=share",0,1556323947.0,bhtcim,44,MGTOW
1079,"One more reason to go your own way, the medical field is against you knowing if the kid is yours or not",0,1556284776.0,bhm6nx,303,MGTOW
1080,No Family for You!,0,1556305275.0,bhq2vu,106,MGTOW
1081,"""Why do women storm into male-only or male-oriented spaces and start redecorating, insisting on switching out the Rage Against The Machine with Sarah McClachlan CDs, and ordering everyone to watch their language? Is it insecurity? Is it boredom? Is it general evilness? What?""

https://www.youtube.com/watch?v=KBgcjtE0xrE",0,1556373964.0,bhzduv,3,MGTOW
1082,Search autofilled suggestions on Tumblr show unrestrained hate against men,0,1556373922.0,bhzdly,3,MGTOW
1083,Surreal Dems believe you shouldnt be able to defend yourself.,0,1556368274.0,bhymbf,5,MGTOW
1084,Woman who bashed 8 month old child walks free and gets part custody,0,1556275873.0,bhkxrj,460,MGTOW
1085,Hahaha,0,1556298800.0,bhotqz,145,MGTOW
1086,"I've always liked older movies because they seem to have a lot less bullshit. I have seen other movie recommendations on this sub but for only one or two movies at a time. For a few years I have been keeping a list of movies I like, ranked in order, and I'm up to 27. 

This may not be your taste in movies but this is a big list of movies that are mgtow friendly. If you have more, please comment them.


1. The road warrior
 
2. Badlands

  3. Flash Gordon 

  4. Fight club

5. Death race 2000

6. The good the bad and the ugly

7. Taxi Driver

8. Saturday Night Fever

9. The Ten Commandments

10. Indiana jones and the last crusade

11. Ghostbusters

12. Dune

13. Casino

14. Raiders of the lost ark

15. Colossus: the forbin project

16. Dark Star

17. Two lane blacktop

18. Christine

19. Evil dead

Edit: into the wild

20. Moonraker

21. Silent running

22. The naked prey

23. its a mad mad mad world

24. The blues brothers

25. First Blood

26. They Live

27. Easy rider",0,1556334252.0,bhuv6n,21,MGTOW
1087,MGTOW Bumper Sticker spotted today in Dallas,0,1556295859.0,bho8wf,156,MGTOW
1088,"I was brought up with the idea of the nuclear family and a white picket fence being drilled into me despite the fact that my family didn't come close to representing this. I am a 20 year old aerospace engineering student with a savings, job (since 14), and stocks. I box, shoot, and explore back country with nothing but a map, compass, and basic first aid/survival equipment. To challenge myself mentally I read, I have read the Bible, the Koran, Common Sense, 1984, and the Communist Manifesto, and many other significant books in human history. I have a passion for engineering and have my eyes locked on my goals.

Most women seem simply seem animalistic. They seem to be a 10 Watt bulb and totally uninteresting. However, if a unicorn exists it is there where they could be found in the small ""traditional"" segment. However, the only person I could remotely tolerate is someone with a similar level of intellect but that is the most dangerous as they know they can use the system to get you. There is no winning, none. This is a no win situation were the only option is not to play.",0,1556357993.0,bhxhqn,6,MGTOW
1089,"If someone can?t iterate on your school of thought you?re either a huge moron or very ahead of the curve. Based on empirical and factual evidence: I can factually concur that someone who goes MGTOW is winning. 

It?s a scientific fact. 

50% of marriages end in divorce and in all of the cases where a man is involved they are at a disadvantage, based on historical trends of women receiving preferential treatment in the courts. 

In the end MGTOW is the way. Science supports it. The data is there. What are you waiting for? To be another statistic? To shoot your load? That?s what hookers are for.",0,1556342048.0,bhvuvh,15,MGTOW
1090,"Who Paid for Your Coachella Ticket?
https://youtu.be/89-9BCglhkw

P.S. Could we start a petition to nuke the planet and start over?",0,1556340165.0,bhvmut,14,MGTOW
1091,Bad woman influence ruin men,0,1556375985.0,bhzoxq,2,MGTOW
1092,The custody rapists are trying to say my place is unsafe.,0,1556298335.0,bhoqfv,112,MGTOW
1093,Found on a Facebook beer drinking group - it effects everyone,0,1556317777.0,bhsby4,44,MGTOW
1094,"I don't care how much you make, you're doing nothing with your life",0,1556262307.0,bhjdzs,685,MGTOW
1095,Speaks for itself,0,1556375700.0,bhznbr,2,MGTOW
1096,This is maddening. If the roles were reversed dude would be dragged through the internet as a monster. Also hope all my brothers out there have a good weekend!,0,1556316973.0,bhs70g,47,MGTOW
1097,Look at this 2,0,1556375290.0,bhzkz7,2,MGTOW
1098,Truth,0,1556294022.0,bhnw02,132,MGTOW
