,body,class,date,id,score,subreddit
1445,"A girl I was pretty decent friends with about a decade+ ago, like 2006/2007 just got back in touch with me. 

Some context, she was an ex-girlfriend of a best friend. I never knew them as a couple, I met him after they broke up. She was still part of the fairly large social group we existed in and I had sex with her best friend once. So, that?s how I met her. 

We hit it off, but I had a girlfriend at the time so: nothing more than words. 

After I finished/during the breakup with my then girlfriend I visited her at her University (different city). 

I remember us having a long drawn out conversation about ?life? and ?goals? and ?where are we even gonna be in 10 years? over a few beers and about a whole pack of cigarettes, at this party I?d somehow been assuaged into attending. 

Ultimately deciding that, even if we?re ?so right? it?s not gonna work because who knows where we?ll even end up. 

My friend was in the same city, so I stayed with him. 

I distinctly remember finishing the conversation with ?well I have to go.. think about what I said?.

It was drunk philosophy at best. I was going through a break up, she just ended one. 

After that, there was a lot of texting and a few drunken phone calls. Then she got a new boyfriend and that was it. The End. 

At that point, she was 19, I was 22.

Countdown to 10 years later, yesterday in fact...

?Hey!?

(I?m 33 now, and don?t look that much different from 11 years ago, other than I got really big and hench, so she?s 30 now. The wall hits them all).",0,1556169931.0,bh4x3x,19,MGTOW
1446,Simple Pleasures really.. today i found this absolute unit,0,1556172450.0,bh57xv,16,MGTOW
1447,Honk Honk,0,1556104897.0,bgtdra,410,MGTOW
1448,"It's a bit old but will remind it's not worth it

[https://www.youtube.com/watch?v=N0n-iaob0rI](https://www.youtube.com/watch?v=N0n-iaob0rI)",0,1556154670.0,bh2lcd,32,MGTOW
1449,What?s the first rule of fight club?,0,1556121939.0,bgwfe4,168,MGTOW
1450,Lol,0,1556127227.0,bgxhwg,122,MGTOW
1451,"You heard it from the feminists first, they want men to go their own way.",0,1556218908.0,bhcgir,1,MGTOW
1452,"I just watched a mediocre movie called Overlord (2018) about a platoon of soldiers invading Normandy on D-Day and ending up in the middle of some demented Nazi lab experiment while trying to complete their mission.  The platoon was from the 101st Airborne,  which is the same one from the book / TV series ""Band of Brothers"", which hopefully most of you have seen.  Watching the movie and thinking on the differences between the two; main character in Overlord was a black guy with a good heart and conscience, naturally there was a pretty, waif-like girl who also kicked arse and took names, the Nazis were movie stereotype Nazis (cruel, mad, psychotic, etc) and the rest of the guys in the platoon were pretty one-dimensional stereotypes (""tough guy"", ""wise-cracking cynic"", etc).

Compared this to Band of Brothers (2001) which had no kick-arse femme fatales, I'm not even sure I can recall a single black or Asian guy in it and most of the Germans were portrayed as normal soldiers as well.  It was a TV series focused on being faithful to Stephen E Ambrose's book and historically accurate / realistic with no other agendas at play.  A series completely focused on making a quality production and nothing else.  It struck me that if that series was (re)made now, how badly would today's demand for equal representation, inclusion and shoe-horning social narratives into big budget productions fuck it up?  Would Easy Company suddenly have POCs and tiny girls beating up men twice their size to show women's strongkth?  Maybe a few quips about the wage gap and being able to do everything men can do while wearing heels?

Thank Christ that show was made 20 years ago.  I'm going to make some time to watch it again.

Anyone got any other similar recommendations for good watching / reading that are similarly untouched by social agendas?

Edit: to clarify, I don't have any issues with various races, ethnicities, etc, but if they weren't there at the time, please don't go revising history adding colour, gender, etc to appease screeching harpies.",0,1556170066.0,bh4xs1,17,MGTOW
1453,"So I never could comprehend the fascination men have with dating. It doesn?t make financial, mental or physical sense. There are countless hookup apps and ?empowered? women escorting. What?s the point of dating? I find that loving one?s self and inner security is best.

TLDR I just finished 2 episodes of my amateur porn series.",0,1556218613.0,bhcecb,3,MGTOW
1454,"Now, I know that most of the guys here in this subreddit are born into the first world and my rant might not hit home. But, I think this is the only place where I can rant about my life:

&#x200B;

* I was born into a third world country into a broken family with a single mother. You can probably guess how much success I have ( or more specifically given opportunity to ) in life.
* I probably could have given a good height, attractive face or talents as compensation but no, I'm a short average looking guy not even local thot's look at.
* Despite my best efforts and business hustles I still save around $15'000 a year. I can take a guess that average 16 year old in USA can make more without moving his/her ass.
* While my rich ( government official's children ) peers got to get their first blowjob from a model at 14 and buy a bugatti at 16, I got to sleep in a trench and beaten by officers decades older than me thanks to our national draft.
* My mother was never good at making money even worse at saving them, so I had to work instead of study.
* I follow my dreams and work, yet each time I do little progress another year is past. I don't know if 10 years from now will I be a millionaire like I dream or still making shit progress.
* Life doesn't give us cards equally nor I feel seem to conspire to lift who ever is holding a better card and pull down whoever is unfortunate enough to have a shit on his hands.

Please let me know if you had similar struggle",0,1556182987.0,bh6eit,11,MGTOW
1455,"Anybody else a GoT fan and notice how cucked it's become?

I got into the first few seasons, and then have watched the rest and the current one out of sheer momentum and curiosity to see how it wraps up.

But the last season or two, and this one by leaps and bounds, have seen pretty much all the male characters reduced to whimpering pawns of the leading female characters. It's as though a team of blue haired 3rd wave feminists came in and started writing the show. Though given the broader story, and the curious obsession with male castration in the form of what happened to Theon and the needless abundance of eunuchs and castrated men, George Martin himself is clearly processing through some weird personal psychology in his writings.",0,1556147361.0,bh1dcn,43,MGTOW
1456,"I feel this topic is too important and it may be the number one thing that pulls a MGTOW man back to the plantation. I can not understate the power of this phenomenon if you are out there dating casually, if you're truly red pill and you understand all aspects of female nature and how to avoid the chameleons, then it's the number one thing you're going to hear from your ""alpha male"" friends when they brag about their new girlfriend.

I have dealt with so many women trying this crap in the first phase of the relationship, they'll pretend to like the same things as you, to share your world view, you know, they're different from other girls. Don't fall for that bullshit guys. Even if the only part of this act they put on is being well behaved do NOT fall for this. 

I made a short video discussing this topic and would welcome your thoughts on the subject fellow MGTOW men. I also briefly touch on the ""conservative chick"" phenomenon.

 [https://www.youtube.com/watch?v=4K8i70fRABU](https://www.youtube.com/watch?v=4K8i70fRABU) 

I think this is most important for men new to MGTOW because they are especially vulnerable to falling for the trad thot dream. They are going to try this on Red Pill aware men more often than not because they can see that being cute and giving up sex isn't going to be enough for you. (It's good enough for 90% of simps out there they can just be themselves right away with them) 

For many of you this is just review, and you're already basically immune to this but I found myself even getting roped into this less than a year ago by the last girl I dated casually, until I watched a couple more videos and snapped out of it. As always the same rules apply universally, do not move women in to your house. If you want to date, it's just casual sex.",0,1556160748.0,bh3lgp,18,MGTOW
1457,"Times Square, Manhattan",0,1556127759.0,bgxlp5,98,MGTOW
1458,Single moms always make me laugh,0,1556116856.0,bgvf50,171,MGTOW
1459,Marxist Feminism Is Terminal Logic,0,1556103194.0,bgt59n,343,MGTOW
1460,"You often hear it from women; ""why am I attracted to the bad boys?"". Same with men: ""I tried to be nice with girls and got knocked-back. Now I treat them like shit and they come knocking."".

It comes down to control. A woman will despise you if they can control you. The bad boy controls the relationship and the girls hate this. This is why they keep hanging on to the bad boy. Because they want to break him down. That's why women absolutely hate rejection, because the man controlled the narrative and told them to get lost. So the bad boy represents a challenge for them, it keeps their interest levels high thinking about how they are going to take control. Because most of the men are the nice guys and the girls have control and don't have to plot and scheme and hence, their interest levels don't get exercised.

And it's interesting with the real bad guys, the guys that really treat the girls like shit. The girls desire for control is so powerful that they hate themselves for continuing on with this guy but they can't help it. They want to break the guy down even if it means continuing the relationship with a piece of shit. In a way, it's pathetic.

Control the relationship or get controlled.",0,1556139315.0,bgzvpd,50,MGTOW
1461,How they look at you before reporting you to HR...,0,1556082817.0,bgqpf9,919,MGTOW
1462,This seems to be a common theme on this sub,0,1556104036.0,bgt9er,283,MGTOW
1463,"This seems like the only space where men can speak their minds without worry of offending anyone. I am so fucking sick of the shit show thats happening. I am a single guy born in the West and we cannot go a single fucking day without the media labeling us as racist, homophobic, or a radical. I don't give two fucks about anyone or what they do in their personal time. All I want to do is carve out a good life for myself. But everything I enjoy in this life is being outlawed by people whom live in the cities.",0,1556161858.0,bh3ruy,16,MGTOW
1464,"They're people, too.

&#x200B;

&#x200B;

https://i.redd.it/q8t4hf5uu9u21.jpg",0,1556137715.0,bgzkoj,47,MGTOW
1465,"From advice sub:


https://www.reddit.com/r/Advice/comments/bgtm13/my_little_cousin_7f_is_joking_about_me_flashing/
r/AdviceFamily
My little cousin [7/F] is joking about me flashing her
u/throwaway48296
My cousin and I get along really well she's the sweetest girl and I'm unemployed at the moment so I baby sit her for my older cousin for free because I just enjoy her company. I was talking to her while she was playing Minecraft and she asked if she could sleep in my bed. I said no she should sleep in one of the rooms inside because I stay up really late most of the time. She said ""I stay up really late sometimes too but its a secret so don't tell mom"", I said I'm gonna tell her as a joke then she said ""no you can't otherwise I'll tell mom your secret"" and I asked her what was my secret? She paused and thought for a second and said ""that you showed me your doodle"" and then she giggled like she was telling a joke but I'm quite shaken up that she will not realise the repocussions of saying this like that especially with the amount for time we spend together. I've got no clue how I should tackle this or if I should just try to brush it off

TL;DR cousin saying I showed her my penis as a joke and I'm not sure how to handle this",0,1556199089.0,bh8nxc,4,MGTOW
1466,Why NOT to be Captain Save a Ho,0,1556128142.0,bgxof4,74,MGTOW
1467,"I?d heard stories, but I didn?t think they existed",0,1556103414.0,bgt6b0,256,MGTOW
1468,This is how most 40+ year old women feel when they wake up every morning,0,1556112605.0,bgumtr,164,MGTOW
1469,"Before I tell my story I just want to say I've been full MGOTW about 6 months now and its great. Surprisingly I've found many others like me and I want you gentlemen to know you have made a great impact in our lives and you are reaching the next generation ( Right now I'm a junior in high school) .

   
My father used to be a Major in the Air force so about every 4 years we would move. I had somewhat adapted to it by just blocking it in. After my dad retired when I was 13 we moved to Woodstock, GA as a transition year in order to figure out where we wanted to live.  Though in this singular year I met a lot of good friends and a girl.

&#x200B;

Her name was Gwendolyn and she was something. I won't say it was love at first sight because what we had wasn't love.  It was the first time that a certain flame was lit inside me. We began talking pretty quickly and became close. About 3 weeks in she told me she had broken up with her boyfriend because of me (Red flag 1). We knew we had liked each other and she wanted to take it slow which I respected but I didn't understand. She strangely asked me not tell anybody of how we felt, though I would tell my friend would backstab me and tell her. She wouldn't talk to me for a few weeks (Red Flag 2). I remember that day that I was so frustrated with myself and that I cried in the shower for a bit though it would only be that day. I relationship would again stabilize and after a few weeks my cousin had convinced me to ask her out again. This would be about half way through my year and I wanted to enjoy it as much as possible so I did again. Even though we clearly had feelings she didn't want to and by this point she knew I was moving (Red Flag 3). I remember being disappointed but not crushed. We would still be close talking almost everyday and all day. On my last 2 days there she asked me to go to her church with her (For people not in christian dating this is like first base where you meet her friends and she chooses based on their opinions of you, stupid I know). I enjoyed it a lot and spending time with her. We acted like a couple basically the entire time. If you asked me who was the one back then, I would've confidently said her. Though it came much to late. 

&#x200B;

After I moved she wanted to go further. She asked me if we could be unofficially official (Red flag 4). We still kept talking pretty consistently for awhile though it wouldn't last long. About 2 months into long distance she broke it off claiming that every time she felt sad it traced back to her having a boyfriend. I remember just screaming WHAT a million times and to this day still have no idea what it meant. Most of freshmen year I blocked out the pain and focused on playing video games competitively (specifically team fortress 2 if you're interested). Though it slowly creeped in and took over by sophomore year and I was crushed to my very core. I had convinced myself that it was my fault and I didn't fight hard enough for her. I thought about her like a past time and constantly reminded myself of her. About every 1 or 2 months I would have to pour myself out to her to not completely collapse on myself. Most of the time I would have no response and if I did it was a short dialogue about how she did care. Though looking back on it she never cared and if she did she never showed it to me. Things I was confident in my whole life like video games, politics and choir became extremely hard and I could not confidently enjoy them. I was sent to a dark place of self-hatred for myself and I had to rebuild myself in a prison of shame and failure. I eventually blocked out my feelings towards her and began to respect and trust myself again. Late last year we began talking a little again and I let myself feel what I felt when I was 13. I knew it was dangerous for me though she accepted all the compliments that were obviously very obvious even though she had a boyfriend (Red Flag 5). I just recently about 2 months ago finally blocked her out of my life on everything, couldn't see her on social media, blocked and unfriended on all forms of communication so she couldn't talk to me. A good group of gentlemen have fully ushered me out of that era of my life and I am greatly in debt to them. 

&#x200B;

Thank you for listening to my story, and remember the people you think you love have the best opportunity to hurt you the greatest .",0,1556165602.0,bh4c0g,12,MGTOW
1470,Begone thot!,0,1556094650.0,bgs5e2,377,MGTOW
1471,"Going my own way, I realized I had to learn how to cook. At the same time, I decided to change up my diet for the better. I quit processed foods, quit sugar, and cook as much as I can myself from as fresh ingredients as possible. I also keep carbohydrates very, very low, and basically only get them as fibers from vegetables.

I have next-level energy now, I can't remember the last time I had a headache, I no longer have issues waking up, and my mind is sharp as a tack. I can only recommend you fellas do the same, it is so important to have a good diet in order to be the best person you can be.",0,1556098807.0,bgslsp,305,MGTOW
1472,made me laugh,0,1556114126.0,bguwl1,129,MGTOW
1473,They?re all still shrink wrapped,0,1556144133.0,bh0sj0,26,MGTOW
1474,Male ingenuity,0,1556090622.0,bgroy9,427,MGTOW
1475,Financial Times warns if article sources are men,0,1556165372.0,bh4atq,8,MGTOW
1476,Just wanted to ask: What is your favorite movie? I'll start. The Last Samurai,0,1556112331.0,bgul1f,142,MGTOW
1477,Man going his own way,0,1556101024.0,bgsv9u,244,MGTOW
1478,Learn It Live It Love It,0,1556105183.0,bgtf9i,194,MGTOW
1479,"Ever since my last relationship, where my ex accused me of cheating and called me a cheap ass because she refused to let me pay for anything, I?ve noticed better qualities about myself surfacing. 

Suddenly, I have a new found sense of confidence. I can talk to more people easier, not constantly worried about what some woman is going to think because I said it.

I?m also a musician, I?ve never finished a full song within the two years I was in a relationship. I finished a whole song over the last 3 days. 

Learning to let go of toxicity in your life and focus on a better you, and relying on nobody but yourself pays off. There is no disappointment when somebody fails to complete you, because you are already complete with yourself.

With that being said, I hope you all are truly discovering yourselves, and learning of all the amazing things you can accomplish when there is nobody in your way of achieving your dreams.",0,1556134246.0,bgyw1u,46,MGTOW
1480,AWALT,0,1556193416.0,bh7qii,2,MGTOW
1481,Just for laughs,0,1556100701.0,bgstu7,236,MGTOW
1482,My cousin?s boyfriend bought her a car. He signed a contract without reading and now the car is in his name. My cousin can avoid the payments or dump his ass and he has to pay for the car. This is why YGOW!,0,1556156610.0,bh2wqe,12,MGTOW
1483,"Gents, this is about all it takes to become a millionaire in <20 years",0,1556162193.0,bh3tqv,10,MGTOW
1484,"I decided to quit around 2 months ago after reading that it has permanent negative effects (was never addicted to it). I'm a 5""7', unattractive male so obviously I'm a virgin and am not going to get laid (I can jack off without porn but it's harder and doesn't feel as good). so far the only difference I've noticed is an increased desire for relationships and sex despite the fact that I browse this sub multiple times a day and am effectively disgusted by women. is quitting porn worth it?",0,1556177984.0,bh5vh1,3,MGTOW
1485,Was Jesus on MGTOW?,0,1556205016.0,bh9r73,0,MGTOW
1486,King of the Simps,0,1556113862.0,bguux7,111,MGTOW
1487,Okay... TFM is a goddamn time traveler.,0,1556139419.0,bgzweu,27,MGTOW
1488,accurate,0,1556097078.0,bgserm,239,MGTOW
1489,Reality cannot be whatever you want,0,1556134642.0,bgyywa,37,MGTOW
1490,"When female presence in my life was completely foreign, I thought it was the thing I needed most to escape depression. Now that I have a few female friends, it's no longer this amazing cure all I wished for. It's nice to be in their company sometimes, but it also gets incredibly boring. The things they talk about, the things that get them excited, I could not find more uninteresting. I wouldn't know what to do with a romantic partner every single day (other than sex). Every subsequent interaction with women is another layer in the wall between me and a long term relationship.",0,1556133078.0,bgynsp,41,MGTOW
1491,i didnt.,0,1556156351.0,bh2v7b,14,MGTOW
1492," Understand:  the first step towards healing is admitting you have a problem.  


Hopefully, we find a cure for this problem. 

(Thanks to NeonRevolt on Gab).

&#x200B;

https://i.redd.it/oohwva42v9u21.jpg",0,1556138346.0,bgzozm,25,MGTOW
1493,"Once again, ""It's because of the women"" (X-Post r/mensrights)",0,1556112169.0,bgujzx,92,MGTOW
1494,This is what feminism is promoting as part of the bonobo protocol,0,1556097290.0,bgsfn3,193,MGTOW
1495,These electricians sleep 50 meters off the ground. And none of them are women... men build societies...,0,1556117124.0,bgvh0v,72,MGTOW
1496,"So at the conclusion of a recent trip, I had an opportunity to stop in at whats left of my small home town to see relatives. My female cousin and went to a pea shelling. This is where a lot of people gather on someones porch to shell peas, pass a bottle of Wild Turkey and, most importantly, gossip about everyone not there. The men generally do the heavy lifting of moving the bushels of peas, and the women sit and pop the shells off. Sitting in on one of these will red pill you in a hurry.

One story that stuck out was about one woman's granddaughter, though. She had been dating a local Chad. Her parents were against it. Of course Chad's been to jail a few times on drug and burglary charges. Given that this is Florida we're talking about, this is practically like getting your drivers license in other parts of the country. Still the guy straight up told her he wasn't going to marry her.

For her part, she did well in high school, and got a softball scholarship to go to school. Now her grandma is co-owner of a bank so she has some cash, and had put back some money to help the girl through school. Her grandparents had also bought her a car to go back and forth as long as she stayed in school. Naturally she didn't stay in school. 

She proposed to Chad. He shot her down, but kept banging her. So if she gets pregnant Chad has to marry her, right? So she got knocked up and dropped out of school. She led Grandma and Grandpa along a little bit about still being in school, and they wrote a few checks 'for tuition.' Once they worked it out, though, they cut her off and had the car towed. Grandpa bought himself a new truck with the money that was left. It's a pretty nice truck, too.

For his part, Chad still wouldn't marry her. He was still hanging around banging her, though. He also wasn't supporting her, so she had to get a job at a local fast food joint. The baby came and everything stayed status quo for about a year until the hurricane struck and wiped almost everything out, so the job was gone. Her backup plan for that was, once again, to marry Chad.  So she got knocked up a second time. Chad again declined to marry her.

So mom and daughter hatched a plan, and got some support from the local church. They set up a 'surprise wedding' to try to push Chad into 'manning up.' They had the makeshift building the church was in due to damage to the actual church all decked out, a wedding dress, and the works. So she lured Chad up there and sprung this on him. His reaction to being told what was going on was apparently 'Fuck that!' followed by a quick exit.

Chad promptly skipped town after that. I can't say I blame him on that. Imagine walking into a place like that, complete with a small crowd, and some whiteknight trying to put pressure on you. It'd be bewildering and scary at the same time. 

The consensus at the pea shelling was surprisingly even handed, though. Mostly that Chad is a thug, and he is, but that the majority of it is her fault for trying to trap him. Grandma went on at length about how upset she was about the whole thing. Grandpa just showed a group of the guys there how his key fob has a button that makes the running boards on his new truck retract and extend.",0,1556199583.0,bh8r14,1,MGTOW
1497,"Whenever a friend told you this, have you ever observed what they are actually doing?

I've seen a few people in relationships claim this, but it ALWAYS boils down to **""She tells me what I have to do and she grades my work.""**

All of the guys I've shown to be in relationships always claim they're growing as a person, but I always see that their ""growth"" is nothing more than just them turning into the idealized version of what their girlfriend wants them to be. And she always ends up miserable when they are so agreeable.

As for their actual personal growth, it's always tied to the girlfriend's emotional state.",0,1556117922.0,bgvmhy,65,MGTOW
