,body,class,date,id,score,subreddit
2819,"Well a pimp is the person who will traffic you,

Tell you what to do, 

Then he'll torture you,

&#x200B;

But all we need is a little regulation

To reduce strangulation

Women have more choice 

If we just give the pimp a voice

Just give the pimp his way!

&#x200B;

Oh a pimp is a person in your neighborhood,

He's the person that you meet 

When you're walking down the street

He's the person that you meet each day!



Okay so I am super pissed with another forum, trying to sell the ""sex work is work"" crap. They are claiming that it in theory could be, if we just changed our attitudes and legalized it. AND they said that I was morally obligated to prove my bigoted claims, otherwise I was the granny of all bigots from Bigotland. I sent them links from several sources showing that legalization of prostitution increases trafficking. ""Well, that just means fine tuning is in order."" Then I get the whole ""feminists conflate ordinary Playboy with hardcore violent porn."" I sent some links about Hugh Hefner's actual thoughts on women, and explained that even if there are different levels of porn, there are still problems at every level. Back to sex work. ""There are tons of shitty jobs out there. Why are we singling sex work out?""

I try explaining that sure, there are shitty jobs out there. But prostitution depends on human trafficking, violence, slavery, underage girls, disabled women (oh yes) and sometimes outright murder to survive as a business. Even with legalization. Even if even if even if. If you're going to tell me it's just a matter of fine tuning then I'm going to say YOU are morally obligated to tell me what magic little regulation will fix everything. 

Some asshole thought he was being crafty by telling me about nail salons that also trafficked their workers. I pointed out that since those salons are indeed legal and regulated, that's strong evidence to say that it doesn't work for prostitution where customers want to be anonymous and KNOW the prostitutes are underage, exploited, and don't want to be there. When nail salons were exposed, several states in the Northeast did a fast and furious sweep, shutting many of them down in under a month. (This also shows that it's really not hard to shut down a trafficking ring. You just need to get out of your swivel chair and do it). Amazingly, the ""massage parlors"" were left untouched. Male politicians got to look like white knights while still protecting their favorite brothels. 

The truth is, women really don't want to be in prostitution. Naive young women in their gap year don't stay in it for long once they see that it's not what Diablo Cody said it would be. If men want this unicorn of a woman who truly enjoys prostitution, and meets their standards of fuckability, she'd be so rare and so expensive that only billionaires could afford to have tea with her. 

So. How to meet the demand?",0,1555506569.0,be7m6c,46,GenderCritical
2820,"I had to make a new account once I realized if you comment anything that remotely has anything positive about women in those toxic TV show subreddits, incels will attack. After all, 99% of the members are male.

So... I was thinking, can we have a little recap of episodes of different shows here (or should we make GC shows subreddit, or is there something like that)? I don't feel safe anywhere else on Reddit and I would love to comment episodes of my favorite shows. If I am alone in this, I get it, I will watch my shows in solitude and quiet :)

I just watched The Flash 05x18 (Godspeed) and I was so pleasantly surprised how the beginning of the episode was filled with women characters. I just love when a movie or a show has a majority of women cast. The same goes for Star Trek Discovery series, ladies carry the narrative and the action. The Handmaid's Tale is coming here soon and since we are all banned from that subreddit maybe we can continue commenting here?",0,1555520491.0,bea84b,21,GenderCritical
2821,"To start off, I don?t know how to put this into words but I am so fucking happy and relieved that I found this subreddit. This might be long but I?m feeling a little emotional, I apologize.

I?ve found myself growing so disillusioned with liberal feminism in the past 3 years, it started when I decided to finally come out about being sex trafficked and abused by my ex boyfriend when I was 15-16, ?intersectionality? told me that I would be believed (or at least listened to). After I told a couple people I was closest to in real life, I decided to try to bring awareness to the very fucking real epidemic that is sex trafficking. I wasn?t a ?sex worker?, I wasn?t ?empowered?, i was a vulnerable teenager who was being beaten and raped. 

I wanted to be anonymous about it to protect myself and my image (because while I thought it was important, I was still afraid that coming out about rape is not the hug/cry/love fest we?re told it is) so I tried posting about it on twox, I was called a SWERF. I didn?t even know what the fuck that meant. I was victim blamed for not telling the police about the rape when my parents made me take him to court for a restraining order (i only got a no contact order and he stalked me until I moved out of the state almost 3 years later lol). 

After that I started seeing the glaring cracks in their ideology; lesbians being shamed for not wanting to sleep with someone who has a dick, ?sex positivity? being burdened by a rhetoric that pushes the liability upon violated women to ?liberate? ourselves as if we?re prisoners of our own minds and nothing else, forcing us to adapt to mens desires even if it HURTS because well golly, saying no to a specific sex act must mean you?re not a Cool Girl! In my relationships with men I was told to just accept their pornography addictions and disgusting fucking fetishes, because that?s all fine and good! Doesn?t matter if it hurts me because it?s something that brings men pleasure! If I say it makes me deeply uncomfortable that must mean i?m an insecure, controlling hag! Not wanting to engage in polyamory means I?m stifling my partners ?natural sexual urges?, I?m sorry but for me, personally, I?m okay with monogamy. Because I?m bisexual that automatically mean I?d date a trans person? No? Well I guess I must be an evil bigot who?s not deserving of love.  Telling women that we NEED to be standing up and saying ?no? to behavior that harms us while shaming us for having the gall to do so when it doesn?t fit a certain worldview. 

I could go on but holy shit it still pains me to this day that so many women are being lied to and spoon-fed this idea of ?tru intersectionality and acceptance!!!? and when they get kicked while they?re down by the same people who claim to support them, they just spit out the blood and keep coming back because the lengths women have been conditioned to go to for self preservation are terrifying.

I hope this made sense, I didn?t mean to rant but I want to thank everyone in this sub for providing a place where women don?t feel the need to censor ourselves.

EDIT: also the rape crisis center in this small ass southern town I live in, the one place I?d find any sort of real life solidarity, has been taken over by gender politics and trans people dominate nearly every conversation. I have no meaningful relationships with women in real life that aren?t dominated by their male partners or men in general. it makes me want to die. Just reading here makes me feel less alone.",0,1555478300.0,be41hw,167,GenderCritical
2822,"Hi everyone, so

recently I kept running into these two arguments when they try to argue that they are valid and real women.

1.) Studies like this one about white matter in trans being the same or similar as it is in females, pre-hormones:

https://www.sciencedirect.com/science/article/pii/S0022395610003250
https://www.frontiersin.org/articles/10.3389/fnhum.2018.00399/full

2.) When they say it's not a mental illness and that scientists/doctors acknowledge that on official sites.

Can you help me out and explain/debunk those? Thank you.",0,1555512176.0,be8lyy,30,GenderCritical
2823,Peak trans for everyone in r/TrueOffMyChest,0,1555466643.0,be2br8,222,GenderCritical
2824,"While the media focuses on trans kids as a distraction, these are the real underlying issues that aren't being addressed...",0,1555508218.0,be7w9a,25,GenderCritical
2825,"A remarkable group of women have effected a profound change in their community. The seven member, all-female council enforced by-laws introduced by elders years earlier.",0,1555482878.0,be4luq,76,GenderCritical
2826,"Watching the episode of will and grace where jack (gay man) is freaking out because he got an erection from a female stripper. Later he finds out the female stripper is a TIM and has a penis still and hes like thank god im still gay. The stripper was extremely feminine and girly and had boobs but still said ""she"" was not a girl because ""she"" had a penis.

How is it possible that even back then the idea of a gay man being with an extremely feminine presenting ""woman"" with a penis was still him being gay. Why are we now called ""vagina fetishists"" if we think TIMS are not lesbians? So messed up.",0,1555458372.0,be0xw8,241,GenderCritical
2827,"Just a bit of a vent but maybe some of you can also offer me some advice on dealing with this friend (if there is any point in even trying).

There's been a lot of mud-slinging on Twitter this past week over a couple of issues: first, more about self-ID and women's sports, secondly some stuff around the recent article published in an Irish paper that (though largely pro trans) raised some legitimate questions about use of the word 'cis'.

I'm mostly too scared to even comment on these issues any more, but since these two points were getting largely sensible responses, I thought I'd weigh in. I didn't say anything remotely terrible (do we ever?) but in response to some naive and inaccurate comments that were getting 'likes' I did give my 2p worth.

This was pretty mild stuff on how it's just not accurate to claim that transwomen aren't at an advantage in female sport, and I also set some people straight on the actual reason why people who reject the idea of a gender binary don't like being called cis (no it isn't to do with the language, yes we know it's Latin). 

Anyway, an online friend of mine who is a libfem and with whom I share views on ALMOST EVERY OTHER ISSUE then went on a mad subtweeting spree about how 'hateful' and 'toxic' 'certain people' were with their views on these poor, oppressed women and how knowing that they hold these views is a sure sign that they must secretly be terrible human beings and probably homophobic too (!!!!).

The trouble is, they can't process the arguments we are putting out there so they simply cannot engage with them. 

There's no point trying to argue is there?

It's just so depressing.

Thanks for listening.",0,1555489555.0,be5c1w,40,GenderCritical
2828,#MeToo has made Republicans *more* sexist,0,1555503501.0,be73dn,19,GenderCritical
2829,"Hello! I?d like to bring up something, that may be not precisely gender critical, but i?d like to discuss it from a radical feminist perspective.And that something is an american pop culture seen from the point of view of an european woman.Firstly I must admit, I actually don?t have a personal experience with US realities and only know United States from the media. And when it comes to a mainstream american entertaining industry, there are few things that are bothering me a little, because judging it by my living experience they seem a bit peculiar.

The first is the absolute lack of interracial couples in movies/series that are not about racism. As if the only allowed interracial relationship in an american movie was a white man and an asian woman.

The second is the absolute lack of female sports in movies/series that take part in american high schools. It really looks like if an american girl wants to move a little, her only option is to become a cheerleader? which I consider a really weird way how to sexualise underage girls.

So my questions are:

1. What, the hell, is this? How've it becamesuch a huge phenomenon?
2. Is this image of mainstream american life really a reflection of a mainstream american reality?  


Edit: I never said, there are literally no interacial couples in the mainstream american pop culture and I really don't need you to send me notifications of them. I'm talking about common trend, which is no iterracial couples except white man and asian woman.",0,1555501320.0,be6rck,14,GenderCritical
2830,FDA Pulls All Vaginal Mesh Products Off the Market,0,1555470641.0,be2yqr,65,GenderCritical
2831,A group of protesting males entered the girl's toilets & cornered one of the girls. She panicked & kneed one of the males in self-defence. She has been suspended from school for defending herself inside her own safe-space.,0,1555430804.0,bdvpdd,473,GenderCritical
2832,"I?ve been thinking about this a lot, and I?m really curious what other GC/radical feminists think. There are a lot of elements of drag that frankly, make me uncomfortable, and even come off as misogynistic. So much of it is based off of **extreme** femininity and/or gender roles. Not only is there the ?costume? aspect - but they also change their behavior when performing in drag. A lot of it is talking like a ?ditz?, playing stupid, acting promiscuous, unrealistic high pitched voice, and exaggerated mannerisms that are ?feminine.? They?re essentially dressing up as misogynistic stereotypes of how they view femininity - especially when you compare it to the drag that women (rarely) do as men. Their drag is often just beards and talking with a low voice - while men are acting stupid/ditzy/overly sexual. Donning huge wigs, fake breasts, revealing clothing, pounds of makeup, heels, etc. 

I might be totally wrong with my interpretation of drag - maybe someone could explain it to me. I?ve never understood. But to me, it just comes off as men performing extreme gendered roles and essentially making fun of femininity. So much of it seems like they are mocking woman - not paying ?homage? to them. My guess is that their defense would be: ?they aren?t mocking femininity! - because what they are performing is such an ?exaggerated? cartoonish version of womanhood that it?s actually ?mocking the patriarchy and gender roles!? 

But I think that?s bullshit. 

And I always come back to the fact that women in drag is so much rarer - you don?t see hordes of women making manhood into a joke or a performance. 

It?s literally just a ?woman costume.?",0,1555458860.0,be10x8,98,GenderCritical
2833,"This sub has made me keenly aware that I truly value opportunities to spend time with other women. I've signed up to volunteer with a local program called BabyRead wherein I will meet with a single mom and her children twice a month at the local library. For each meeting, the program provides snacks and nice hardback books, 1 per child, that I will read to them, and then give them to take home.

I've just been assigned my family, a young black working mother with a toddler and a 4-yr-old. I'm a white retired educator, and the last thing I want to do is come across as 'the great white savior' like I think I'm there to teach her how to read to her kids and judge her parenting skills. As we've talked & texted, I told her I really miss working with kids, and I remember how hard it was when my kids were that age, and I was a working mom, and how overwhelming life could get... that I saw my role as someone who could take the reins for a bit and let her relax while I read to & entertain her kids. All of the nervousness seemed to exhale out of her voice with that.  So, yay?

I don't know anything else about her, but I'm honestly looking just as forward to getting to know her as I am her kids. Because... woman friend! (But I also don't want to come on too strong, lol)

If you were a young mother coming to this program, what would you hope to get out of this situation? Also, black women of this sub, what are some do's and don't's I should be aware of as an older white woman connecting with a young black mother? (I've already requested from the program director that the next books I read to/give the kids have some faces they can relate to better. The illustrations are all white kids. Do I mention this awareness to mom or let it slide?)

We meet for the first time this Thursday, woohoo!",0,1555473468.0,be3dif,42,GenderCritical
2834," Widespread acceptance of trans ideology in progressive circles is less than ten years old. It's easy to forget that. But tv shows serve as a handy reminder of the mores of a particular time. Take Showtime's  ""The L Word"" (2004 - 2009), a show about lesbians. Later seasons of the show include a woman 'transitioning' into becoming a transman. If the  show writers really thought that transwomen were women they would have  included a transwoman in the show, not a transman. Apparently there's a  reboot coming later this year - I bet they'll have a transwoman or two this  time.",0,1555473344.0,be3cwv,41,GenderCritical
2835,"Hi everyone,

I wanted to know if there is a sub for female seperatism? A sub dedicated to women who want to seperate themselfs as much as possible from men in society to escape misogyny and build their lives alone/with another woman/in a female dominated space?

I would like to discuss the difficulties that come with this kind of lifestyle, since I find it kind of hard to find women with a similar mindset.

Thank you in advance.",0,1555449101.0,bdza1p,117,GenderCritical
2836,"I don?t identify 100% with any one subset of feminism. I have things that I like ? quite a lot of things that I like ? about radical feminism, a few from liberal feminism, and a few from other feminisms as well.

But I have to keep that private because I hate, hate, *hate* that there doesn?t seem to be a lot of room for crossover without being considered one thing completely.

Meaning, specifically, you can?t say ?Maybe legalized prostitution will have some negative ramifications that we should seriously consider? without being labeled a TERF. You can?t say ?Hey, maybe we went too far with that whole ?your kink is not my kink?/?no sex shaming? thing post-50-Shades and allowed some very not-okay stuff to be treated legitimately?? without being labeled a TERF. 

I?ll insert a third example when I?m less tired and better able to remember it lol. 

Sort-of side note: I once saw someone whose political beliefs I don?t even know how to label, in retrospect, arguing that an invited speaker in our area, the head of an *Indian organization **that fights literal sex trafficking in the slums of India** was problematic because ?? What she does is anti-sex work?? 

That was truly a brain buster. 

~~Like fuck dude!! Even if you?re arguing that there is such a thing as ?good? sex work, you know how to differentiate it from the rest!! This is literally the bad kind!!~~",0,1555469372.0,be2rn3,44,GenderCritical
2837,Is this basically internalised misogyny? Because I never really understood it when girls say they get along with guys better,0,1555472242.0,be37ak,35,GenderCritical
2838,Funny how you never hear about ftms being violent towards us and it?s only mtf that does it,0,1555450254.0,bdzhvf,95,GenderCritical
2839,"Just wanted to say how much I hate the term, ?Transmisogyny?.

It?s meant to make women and feminists (especially radical feminists) feel like guilty sexists, like we?re going against our own kind.

When did this term become prevalent? Who made it up?

There is no such thing as trans misogyny, because men cannot be women. Period.",0,1555443525.0,bdy73k,128,GenderCritical
2840,"&#x200B;

From a letter [to John Adams](https://founders.archives.gov/documents/Adams/04-01-02-0241), first Vice President of the US:

>?I long to hear that you have declared an independancy?and by the way in the new Code of Laws which I suppose it will be necessary for you to make ***I desire you would Remember the Ladies, and be more generous and favourable to them than your ancestors. Do not put such unlimited power into the hands of the Husbands.*** **Remember all Men would be tyrants if they could.** *If particular care and attention is not paid to the Ladies we are determined to foment a Rebelion, and will not hold ourselves bound by any Laws in which we have no voice, or Representation.*  
>  
>**That your Sex are Naturally Tyrannical is a Truth so thoroughly established as to admit of no dispute**, but such of you as wish to be happy willingly give up the harsh title of Master for the more tender and endearing one of Friend. Why then, not put it out of the power of the vicious and the Lawless to use us with cruelty and indignity with impunity. 

Abigail Adams knew what was up",0,1555433642.0,bdw9e7,186,GenderCritical
2841,The birth of the transsexual empire - UnHerd,0,1555460797.0,be1crf,35,GenderCritical
2842,Incel responds to sexual rejection by women with violence... against a 5 year old boy.,0,1555428362.0,bdv83g,131,GenderCritical
2843,Woman in Assisted Living Has to Prostitute Herself for Basic Needs,0,1555439643.0,bdxfqd,71,GenderCritical
2844,"I"" went to Vegas to visit my family this weekend and was reminded yet again how women are just supposed to be great with objectificatin.  Vegas is basically Patriarchy on steroids. They have lots of billboards there and men are all advertised as doctors, lawyers, magicians, singers, or just portrayed as a normal human being.  if a woman is on a billboard she is always half naked and advertising a sex toy shop or strip club.  On the strip there are men handing out fliers for escorts, even though prostitution is illegal there.(or course it is just the woman that is arrested, not the pimp or johnn) Advertisement though for escorts falls under free speech, who gives a shit about these women forced to do illegal things because they are desperate.  
In the last few years Vegas as tried making objectificartion equal by having shows like MAgic Mike, Thunder Down 
Under and Chipndales.....however the men are never in degrading poses and the shows advertise them as dancers, not ""sex workers"".  It sickens me that feminists used to call this shit out all the time!  Now everything has to be in the context of choice, because men naturallly want to be doctors, lawyers, singers, magicians and basically be seen as normal and women WANT to be nothing more then sex objects for men. And if you think women should be out there choosing to actually better themselves instead of being a stripper or escort you are one of those awful SWERFS who wants to take away women's agency.",0,1555427793.0,bdv3yd,123,GenderCritical
2845,"I used to frequent actuallesbians when I first joined reddit a few years ago. However, since I?ve returned to that sub after a period of time, I?ve begun to think I?ve been living under a damn rock all this time. I go look at the sub description which completely goes against the title of the freaking sub and I cannot wrap my head around it lol. All this ?terf? ?cotton ceiling? ?trans women ARE women? and ?not liking lady dick means you?re not a lesbian but transphobic? bullshit is mind-boggling. Calling lesbianism a sexual preference just further solidifies how homophobic this whole mindset is. It?s so stupid and trivial to me and idc about how it makes anyone feel anymore. It?s the epitome of gaslighting and abusive mental manipulation olympics I can?t keep up. It?s like going so far left that you?ve made a full circle ending with your head up your ass. Again, I?m sorry if this goes against the rules. I needed to rant. Please remove if necessary",0,1555420497.0,bdtt6q,158,GenderCritical
2846,"I like and support the idea of separatism but unfortunately I am only romantically interested in males. My current partner is good as far as males go: cooks and cleans without being asked, gives me money when I want, doesn't watch porn and realizes how horrible it is, and agrees with all of my radfem opinions. 

I am partially disabled and my partner cares for me, so it wouldn't necessarily be a good idea to move out. I just wish I wasn't straight if only so I could only live around women and be sexually and romantically fulfilled.

I've cut out pretty much all my male friends already but I don't know if I could completely separate from men simply due to my orientation",0,1555465167.0,be22pe,15,GenderCritical
2847,"Why Andrea Dworkin is the radical, visionary feminist we need in our terrible times",0,1555414180.0,bdst6k,198,GenderCritical
2848,Poor sad men are rotting from the inside out ?,0,1555455558.0,be0gdt,22,GenderCritical
